[
  {
    "id": "R-ALPHA-S2-12-1",
    "titre": "Costochondrite (titre traduit du NHS)",
    "org": "National Health Service, Royaume-Uni",
    "pays": "GB",
    "type": "information-professionnelle",
    "url": "https://www.nhs.uk/conditions/costochondritis/",
    "note": "Page NHS relue le20.10.2026, révision14.08.2026 : définition, manifestations, alertes et mesures générales. Information institutionnelle pour patients, pas guideline suisse."
  },
  {
    "id": "R-ALPHA-S2-12-2",
    "titre": "Musculoskeletal Chest Wall Pain",
    "org": "Cambridge University Hospitals NHS Foundation Trust, Royaume-Uni",
    "pays": "GB",
    "type": "information-professionnelle",
    "url": "https://www.cuh.nhs.uk/patient-information/musculoskeletal-chest-wall-pain/",
    "note": "Page de la Breast Unit de Cambridge relue le20.10.2026, approuvée14.01.2025 : douleur musculosquelettique perçue au sein, facteurs déclenchants et suivi. Sa fréquence ne décrit pas toutes les consultations thoraciques."
  },
  {
    "id": "R-ALPHA-S2-12-3",
    "titre": "Broken or bruised ribs",
    "org": "National Health Service, Royaume-Uni",
    "pays": "GB",
    "type": "information-professionnelle",
    "url": "https://www.nhs.uk/conditions/broken-or-bruised-ribs/",
    "note": "Page NHS relue le20.10.2026, révision10.01.2024 : imagerie non systématique des blessures simples, maintien de la respiration/toux et signes de lésion pulmonaire ou viscérale."
  },
  {
    "id": "R-ALPHA-S2-12-4",
    "titre": "Le zona",
    "org": "Hôpitaux universitaires de Genève, Suisse",
    "pays": "CH",
    "type": "article",
    "url": "https://pulsations.hug.ch/article/le-zona",
    "note": "Article institutionnel HUG avril2025 relu le20.10.2026 : prodrome, éruption, névralgie persistante et prévention. Portée grand public avec dermatologue identifiée ; aucune dose ni taux transposé."
  },
  {
    "id": "R-ALPHA-S2-12-5",
    "titre": "2023 ESC Guidelines for acute coronary syndromes",
    "org": "European Society of Cardiology ; Oxford University Press, éditeur britannique",
    "pays": "GB",
    "type": "ligne-directrice",
    "url": "https://academic.oup.com/eurheartj/article/44/38/3720/7243210",
    "note": "Recommandation ESC 2023 : extraits primaires Oxford relus le20.10.2026 sur ECG et algorithmes de troponine ultrasensible ; pas de lecture intégrale revendiquée."
  },
  {
    "id": "R-ALPHA-S2-12-6",
    "titre": "Maladie thromboembolique veineuse",
    "org": "Hôpitaux universitaires de Genève, Suisse",
    "pays": "CH",
    "type": "information-professionnelle",
    "url": "https://www.hug.ch/angiologie-et-hemostase/maladie-thromboembolique-veineuse-mtev-thrombose",
    "note": "Page HUG relue le20.10.2026, mise à jour09.09.2025 : signes et démarche séquentielle de maladie thromboembolique ; indication des tests à contextualiser par probabilité clinique."
  },
  {
    "id": "R-ALPHA-S2-12-7",
    "titre": "What do we know about Tietze’s syndrome?",
    "org": "Rokicki et al. ; Termedia, revue polonaise de chirurgie thoracique",
    "pays": "PL",
    "type": "article",
    "url": "https://www.termedia.pl/What-do-we-know-about-Tietze-s-syndrome-,40,33820,1,1.html",
    "note": "Revue narrative2018, texte éditeur relu le20.10.2026 : distinction clinique par gonflement, diagnostics concurrents, imagerie ciblée. Source complémentaire de synthèse, ni essai primaire ni recommandation officielle ; aucune fréquence ou thérapeutique spécialisée transposée."
  },
  {
    "id": "R-ALPHA-S3-1-1",
    "titre": "Terminology: Pain, revised definition 2020",
    "org": "International Association for the Study of Pain, association professionnelle mondiale basée aux États-Unis",
    "pays": "US",
    "type": "glossaire",
    "url": "https://www.iasp-pain.org/resources/terminology/?ItemNumber=1698-Pain",
    "note": "Définition officielle IASP2020 et notes relues le20.10.2026 ; association mondiale américaine, reformulation française corrigée. Usage exclusivement dans S3.1 c[0]."
  },
  {
    "id": "R-ALPHA-S3-1-2",
    "titre": "Douleur abdominale aiguë",
    "org": "Hôpitaux universitaires de Genève, Suisse",
    "pays": "CH",
    "type": "manuel",
    "url": "https://www.hug.ch/sites/interhug/files/atelier_mpr/douleur_abdominale_aigue.pdf",
    "note": "Enseignement HUG du11.10.2017 relu le20.10.2026 : démarche, abdomen aigu et vignettes. Support ancien, aucune fréquence ni schéma thérapeutique ancien transposé."
  },
  {
    "id": "R-ALPHA-S3-1-3",
    "titre": "ESVS 2025 Clinical Practice Guidelines on Diseases of the Mesenteric and Renal Arteries and Veins",
    "org": "European Society for Vascular Surgery, organisme enregistré au Royaume-Uni",
    "pays": "GB",
    "type": "ligne-directrice",
    "url": "https://college-vasculaire.com/storage/page_paragraphe/25/page_paragraphe_fichier/68a731c50a3f1354579097d155973e1e.pdf",
    "note": "Recommandation ESVS2025, PDF original ouvert le20.10.2026 : recommandations31–33, prise en charge des occlusions artérielles, hypoperfusion et thromboses veineuses. Copie institutionnelle française."
  },
  {
    "id": "R-ALPHA-S3-1-4",
    "titre": "ESVS 2024 Clinical Practice Guidelines on Abdominal Aorto-Iliac Artery Aneurysms",
    "org": "European Society for Vascular Surgery, organisme enregistré au Royaume-Uni",
    "pays": "GB",
    "type": "ligne-directrice",
    "url": "https://air.unimi.it/retrieve/ca50b4ae-cbf2-415c-b121-7d28e5c5b10f/1-s2.0-S1078588423008894-main.pdf",
    "note": "Recommandation ESVS2024 : passages primaires indexés relus le20.10.2026 dans copie universitaire milanaise, chapitre rupture/angioscanner et transfert direct au bloc si trop instable. Ouverture des PDF de Turin/Milan refusée, site ESVS redirige vers connexion ; pas de lecture intégrale revendiquée."
  },
  {
    "id": "R-ALPHA-S3-1-5",
    "titre": "Diagnosis - Ectopic pregnancy",
    "org": "National Health Service, Royaume-Uni",
    "pays": "GB",
    "type": "information-professionnelle",
    "url": "https://www.nhs.uk/conditions/ectopic-pregnancy/diagnosis/",
    "note": "Page NHS diagnostic GEU relue le20.10.2026 ; symptômes, échographie transvaginale et biologie. Les limites de grossesse de localisation inconnue sont confrontées à la recommandation NICE ajoutée."
  },
  {
    "id": "R-ALPHA-S3-1-6",
    "titre": "Abdomen aigu aux urgences",
    "org": "Hôpitaux universitaires de Genève, Suisse",
    "pays": "CH",
    "type": "manuel",
    "url": "https://www.hug.ch/sites/interhug/files/atelier_mpr/abdomen_aigu_urgences.pdf",
    "note": "Support HUG Abdomen aigu aux urgences ouvert et relu le20.10.2026 : localisation et diagnostics alternatifs ; date interne non visible. Pas de recommandation contemporaine de dose déduite."
  },
  {
    "id": "R-ALPHA-S3-1-7",
    "titre": "Acute pain in adults admitted to the emergency room",
    "org": "Centre hospitalier universitaire vaudois, Suisse ; Swiss Medical Weekly",
    "pays": "CH",
    "type": "article",
    "url": "https://smw.ch/index.php/smw/article/download/725/722/1438",
    "note": "Article CHUV/Swiss Medical Weekly2007 relu le20.10.2026 : développement et implantation d’un algorithme d’antalgie, prévention de douleur des procédures et réévaluation. Ce n’est pas un essai clinique contemporain ; aucune dose reprise."
  },
  {
    "id": "R-ALPHA-S3-1-8",
    "titre": "Pancréatite — diagnostic, recommandation 3.14 (titre traduit)",
    "org": "Deutsche Gesellschaft für Gastroenterologie, Verdauungs- und Stoffwechselkrankheiten",
    "pays": "DE",
    "type": "ligne-directrice",
    "url": "https://www.dgvs.de/new-leitlinien/chapter_69b2e306cc8e5/chapter_69b2e307aea5d/",
    "note": "Chapitre original de la recommandation allemande2021, version numérique ouverte le20.10.2026 : diagnostic sur deux des trois critères. Portée diagnostique limitée, aucune dose ni stratégie thérapeutique reprise."
  },
  {
    "id": "R-ALPHA-S3-1-9",
    "titre": "Grossesse extra-utérine et fausse couche — diagnostic de grossesse intra-utérine viable et ectopique tubaire (titre traduit)",
    "org": "National Institute for Health and Care Excellence, Royaume-Uni",
    "pays": "GB",
    "type": "ligne-directrice",
    "url": "https://www.nice.org.uk/guidance/NG126/chapter/diagnosis-of-viable-intrauterine-pregnancy-and-of-tubal-ectopic-pregnancy",
    "note": "Extraits primaires NICE relus le20.10.2026 : grossesse de localisation inconnue, primauté des symptômes et hormone seule non localisatrice. Ouverture complète refusée ; pas de lecture intégrale revendiquée."
  }
]
